{
  "id": "enemy:slime_elder",
  "templateId": "enemy_template:slime",
  "displayName": "老史莱姆",
  "regionId": "region:green_hollow",
  "position": { "x": 16, "y": 0, "z": -10 },
  "tags": ["elite"],
  "overrides": {
    "baseAttributes": {
      "maxHp": 44,
      "hp": 44,
      "attack": 8,
      "defense": 2
    }
  }
}
